name,format,Id,description,summary,input_parameters_with_datatype,output_parameters_with_datatype,url,method
TaxCostCalculator,"TaxCostCalculator(price, tax_rate) -> taxCost",409,This API calculates the tax cost of a certain price.,This API calculates the tax cost of a certain price.,"[{'name': 'price', 'description': 'the price of the item', 'datatype': 'Float'}, {'name': 'tax_rate', 'description': 'the tax rate to be applied', 'datatype': 'Float'}]","[{'name': 'taxCost', 'description': 'the calculated tax cost', 'datatype': 'Float'}]",,
FlightInfo,"FlightInfo(city_from, city_to, date_from, date_to) -> flightDetails",410,This API retrieves detailed information about flights including its cost.,This API retrieves detailed information about flights including its cost.,"[{'name': 'city_from', 'description': 'the city of departure', 'datatype': 'String'}, {'name': 'city_to', 'description': 'the city of arrival', 'datatype': 'String'}, {'name': 'date_from', 'description': 'the start date of the flight', 'datatype': 'Date'}, {'name': 'date_to', 'description': 'the end date of the flight', 'datatype': 'Date'}]","[{'name': 'flightDetails', 'description': 'detailed information about flights including its cost', 'datatype': 'Object'}]",,
CountryWeather,"CountryWeather(city, date) -> weatherDetails",411,This API returns the weather information in a certain city at a certain date.,This API returns the weather information in a certain city at a certain date.,"[{'name': 'city', 'description': 'the city for which weather information is required', 'datatype': 'String'}, {'name': 'date', 'description': 'the date for which weather information is required', 'datatype': 'Date'}]","[{'name': 'weatherDetails', 'description': 'the weather information in a certain city at a certain date', 'datatype': 'Object'}]",,
WeatherEffectPrice,"WeatherEffectPrice(city, date, original_price) -> adjustedPrice",412,This API calculates the potential effects of weather on flight prices.,This API calculates the potential effects of weather on flight prices.,"[{'name': 'city', 'description': 'the city for which weather effects on flight prices are to be calculated', 'datatype': 'String'}, {'name': 'date', 'description': 'the date for which weather effects on flight prices are to be calculated', 'datatype': 'Date'}, {'name': 'original_price', 'description': 'the original price of the flight', 'datatype': 'Float'}]","[{'name': 'adjustedPrice', 'description': 'the potential adjusted price of the flight considering weather effects', 'datatype': 'Float'}]",,
ResturantNearCinema,"ResturantNearCinema(city, cinema_name) -> restaurant",413,This API finds a restaurant near a specific cinema in a city.,This API finds a restaurant near a specific cinema in a city.,"[{'name': 'city', 'description': 'the name of the city', 'datatype': 'String'}, {'name': 'cinema_name', 'description': 'the name of the cinema', 'datatype': 'String'}]","[{'name': 'restaurant', 'description': 'the recommended restaurant', 'datatype': 'String'}]",,
TableBooking,"TableBooking(restaurant_name, time) -> booking",414,This API allows users to book a table in a specific restaurant at a specified time.,This API allows users to book a table in a specific restaurant at a specified time.,"[{'name': 'restaurant_name', 'description': 'the name of the restaurant', 'datatype': 'String'}, {'name': 'time', 'description': 'the time for table booking', 'datatype': 'Time'}]","[{'name': 'booking', 'description': 'the booking status', 'datatype': 'String'}]",,
HotelFinder,"HotelFinder(city, star_rating) -> hotel_name",415,This API finds all hotels in a particular city with the specified star rating.,This API finds all hotels in a particular city with the specified star rating.,"[{'name': 'city', 'description': 'the name of the city', 'datatype': 'String'}, {'name': 'star_rating', 'description': 'the star rating of the hotel', 'datatype': 'Integer'}]","[{'name': 'hotel_name', 'description': 'the name of the hotel', 'datatype': 'String'}]",,
RoomBooking,"RoomBooking(hotel_name, number_of_rooms, check_in_date, check_out_date) -> booking_confirmation",416,This API books the specified number of rooms in the given hotel for the duration of stay.,This API books the specified number of rooms in the given hotel for the duration of stay.,"[{'name': 'hotel_name', 'description': 'the name of the hotel', 'datatype': 'String'}, {'name': 'number_of_rooms', 'description': 'the number of rooms to book', 'datatype': 'Integer'}, {'name': 'check_in_date', 'description': 'the check-in date', 'datatype': 'Date'}, {'name': 'check_out_date', 'description': 'the check-out date', 'datatype': 'Date'}]","[{'name': 'booking_confirmation', 'description': 'the booking confirmation', 'datatype': 'String'}]",,
FlightBooking,"FlightBooking(origin, destination, departure_date, return_date) -> flight_details",417,This API books a flight from the origin to the destination for the given dates.,This API books a flight from the origin to the destination for the given dates.,"[{'name': 'origin', 'description': 'the origin of the flight', 'datatype': 'String'}, {'name': 'destination', 'description': 'the destination of the flight', 'datatype': 'String'}, {'name': 'departure_date', 'description': 'the departure date', 'datatype': 'Date'}, {'name': 'return_date', 'description': 'the return date', 'datatype': 'Date'}]","[{'name': 'flight_details', 'description': 'the details of the flight', 'datatype': 'String'}]",,
BoatDetail,BoatDetail(boat_id) -> boat_location,418,This API is to query the location information of the boat.,This API is to query the location information of the boat.,"[{'name': 'boat_id', 'description': 'the ID of the boat', 'datatype': 'String'}]","[{'name': 'boat_location', 'description': 'the location of the boat', 'datatype': 'String'}]",,
TideCheck,TideCheck(boat_location) -> tide_status,419,This API is to check the tide status of a location.,This API is to check the tide status of a location.,"[{'name': 'boat_location', 'description': 'the location of the boat', 'datatype': 'String'}]","[{'name': 'tide_status', 'description': 'the tide status of the location', 'datatype': 'String'}]",,
BoatStatus,BoatStatus(boat_id) -> status,420,This API is to check the status of the boat.,This API is to check the status of the boat.,"[{'name': 'boat_id', 'description': 'the ID of the boat', 'datatype': 'String'}]","[{'name': 'status', 'description': 'the status of the boat', 'datatype': 'String'}]",,
CityDetail,CityDetail(city_name) -> city_coordinates,421,This API is to get the coordinates of a city.,This API is to get the coordinates of a city.,"[{'name': 'city_name', 'description': 'the name of the city', 'datatype': 'String'}]","[{'name': 'city_coordinates', 'description': 'the coordinates of the city', 'datatype': 'String'}]",,
PollutionCheck,PollutionCheck(city_coordinates) -> pollution_index,422,This API is to check the pollution index of a location.,This API is to check the pollution index of a location.,"[{'name': 'city_coordinates', 'description': 'the coordinates of the city', 'datatype': 'String'}]","[{'name': 'pollution_index', 'description': 'the pollution index of the location', 'datatype': 'Integer'}]",,
TrafficStatus,TrafficStatus(city_name) -> traffic_status,423,This API is to check the traffic status in the city.,This API is to check the traffic status in the city.,"[{'name': 'city_name', 'description': 'the name of the city', 'datatype': 'String'}]","[{'name': 'traffic_status', 'description': 'the traffic status in the city', 'datatype': 'String'}]",,
MovieSchedule,MovieSchedule(movie_id) -> schedule,424,This API is to get the schedule of a movie.,This API is to get the schedule of a movie.,"[{'name': 'movie_id', 'description': 'the id of the movie', 'datatype': 'Integer'}]","[{'name': 'schedule', 'description': 'the schedule of the movie', 'datatype': 'String'}]",,
ClosetCinema,ClosetCinema(schedule) -> cinema_location,425,This API is to get the nearest cinema playing a movie at a given schedule.,This API is to get the nearest cinema playing a movie at a given schedule.,"[{'name': 'schedule', 'description': 'the schedule of the movie', 'datatype': 'String'}]","[{'name': 'cinema_location', 'description': 'the location of the nearest cinema', 'datatype': 'String'}]",,
RestaurantReview,RestaurantReview(restaurant_name) -> review_report,426,This API is to provide the recent reviews of a specific restaurant.,This API is to provide the recent reviews of a specific restaurant.,"[{'name': 'restaurant_name', 'description': 'the name of the restaurant', 'datatype': 'String'}]","[{'name': 'review_report', 'description': 'the recent reviews of the restaurant', 'datatype': 'String'}]",,
CuisineRecommendations,"CuisineRecommendations(review_report, dietary_preferences) -> cuisine",427,This API provides cuisine recommendations based on the reviews and the dietary preferences of the user.,This API provides cuisine recommendations based on the reviews and the dietary preferences of the user.,"[{'name': 'review_report', 'description': 'the recent reviews of the restaurant', 'datatype': 'String'}, {'name': 'dietary_preferences', 'description': 'the dietary preferences of the user', 'datatype': 'String'}]","[{'name': 'cuisine', 'description': 'the recommended cuisine', 'datatype': 'String'}]",,
HotelBooking,"HotelBooking(destination, check_in_date, check_out_date) -> hotel_booking",428,This API books a hotel in the specific location for the given dates.,This API books a hotel in the specific location for the given dates.,"[{'name': 'destination', 'description': 'the destination city', 'datatype': 'String'}, {'name': 'check_in_date', 'description': 'the check-in date', 'datatype': 'Date'}, {'name': 'check_out_date', 'description': 'the check-out date', 'datatype': 'Date'}]","[{'name': 'hotel_booking', 'description': 'the booking details of the hotel', 'datatype': 'Object'}]",,
ItineraryPlanner,"ItineraryPlanner(flight_details, hotel_booking) -> itinerary",429,This API plans an itinerary based on the flight and hotel booking details.,This API plans an itinerary based on the flight and hotel booking details.,"[{'name': 'flight_details', 'description': 'the details of available flights', 'datatype': 'List'}, {'name': 'hotel_booking', 'description': 'the booking details of the hotel', 'datatype': 'Object'}]","[{'name': 'itinerary', 'description': 'the planned itinerary', 'datatype': 'Object'}]",,
FoodMenuQuery,FoodMenuQuery(restaurant) -> food_menu,430,This API is used to find out the food menu of a specific restaurant.,This API is used to find out the food menu of a specific restaurant.,"[{'name': 'restaurant', 'description': 'the name of the restaurant', 'datatype': 'String'}]","[{'name': 'food_menu', 'description': 'the menu of the specified restaurant', 'datatype': 'String'}]",,
RestaurantByLocation,RestaurantByLocation(location) -> restaurantData,431,This API provides restaurant information in a specific location.,This API provides restaurant information in a specific location.,"[{'name': 'location', 'description': 'the location where the user is', 'datatype': 'String'}]","[{'name': 'restaurantData', 'description': 'the data of restaurants in the specified location', 'datatype': 'JSON'}]",,
CuisineByRestaurant,CuisineByRestaurant(restaurantData) -> cuisineData,432,This API provides information on the cuisine offered by specific restaurants.,This API provides information on the cuisine offered by specific restaurants.,"[{'name': 'restaurantData', 'description': 'the data of restaurants', 'datatype': 'JSON'}]","[{'name': 'cuisineData', 'description': 'the data of cuisines offered by the restaurants', 'datatype': 'JSON'}]",,
FoodDelivery,FoodDelivery(cuisineData) -> deliveryETA,433,This API provides the estimated time of arrival for food delivery based on restaurant and cuisine details.,This API provides the estimated time of arrival for food delivery based on restaurant and cuisine details.,"[{'name': 'cuisineData', 'description': 'the data of cuisines', 'datatype': 'JSON'}]","[{'name': 'deliveryETA', 'description': 'the estimated time of arrival for food delivery', 'datatype': 'Time'}]",,
RestaurantByname,RestaurantByname(restaurant_name) -> restaurant_info,434,This API provides detailed information about a specific restaurant.,This API provides detailed information about a specific restaurant.,"[{'name': 'restaurant_name', 'description': 'the name of the restaurant', 'datatype': 'String'}]","[{'name': 'restaurant_info', 'description': 'detailed information about the restaurant', 'datatype': 'Object'}]",,
FoodByDietType,FoodByDietType(diet_type) -> food_list,435,This API provides a list of foods based on a specific diet type.,This API provides a list of foods based on a specific diet type.,"[{'name': 'diet_type', 'description': 'the type of diet', 'datatype': 'String'}]","[{'name': 'food_list', 'description': 'a list of foods based on the diet type', 'datatype': 'List'}]",,
BestOrder,"BestOrder(restaurant_info, food_list) -> order_info",436,This API provides the best order suggestion based on the restaurant and diet type.,This API provides the best order suggestion based on the restaurant and diet type.,"[{'name': 'restaurant_info', 'description': 'detailed information about the restaurant', 'datatype': 'Object'}, {'name': 'food_list', 'description': 'a list of foods based on the diet type', 'datatype': 'List'}]","[{'name': 'order_info', 'description': 'the best order suggestion', 'datatype': 'Object'}]",,
EventFinder,"EventFinder(city, date) -> events",437,This API provides information about events happening in a city on a certain date.,This API provides information about events happening in a city on a certain date.,"[{'name': 'city', 'description': 'the name of the city', 'datatype': 'String'}, {'name': 'date', 'description': 'the date for the event search', 'datatype': 'String'}]","[{'name': 'events', 'description': 'a list of events happening in the city on the specified date', 'datatype': 'List'}]",,
TripAdvisor,"TripAdvisor(weather, restaurants, events) -> trip_advice",438,"This API helps in advising your trip by combining weather, restaurants, and events information.","This API helps in advising your trip by combining weather, restaurants, and events information.","[{'name': 'weather', 'description': 'the weather forecast for the city on the specified date', 'datatype': 'String'}, {'name': 'restaurants', 'description': 'a list of recommended restaurants in the city', 'datatype': 'List'}, {'name': 'events', 'description': 'a list of events happening in the city on the specified date', 'datatype': 'List'}]","[{'name': 'trip_advice', 'description': 'advice for your trip based on the weather, restaurants, and events information', 'datatype': 'String'}]",,
SearchMovie,"SearchMovie(genre, location) -> movie_details",439,This API is to search a movie of a specified genre at a specific location.,This API is to search a movie of a specified genre at a specific location.,"[{'name': 'genre', 'description': 'the genre of the movie', 'datatype': 'String'}, {'name': 'location', 'description': 'the location where the movie is searched', 'datatype': 'String'}]","[{'name': 'movie_details', 'description': 'the details of the movie', 'datatype': 'String'}]",,
CheckShowtimes,"CheckShowtimes(movie_name, date) -> showtime_details",440,This API is to check the showtimes for a specified movie on a certain date.,This API is to check the showtimes for a specified movie on a certain date.,"[{'name': 'movie_name', 'description': 'the name of the movie', 'datatype': 'String'}, {'name': 'date', 'description': 'the date for which showtimes are checked', 'datatype': 'String'}]","[{'name': 'showtime_details', 'description': 'the details of the showtimes', 'datatype': 'String'}]",,
BookTickets,"BookTickets(movie_name, showtime, number_of_tickets) -> booking_status",441,This API is to book a specified number of tickets for a movie at a certain showtime.,This API is to book a specified number of tickets for a movie at a certain showtime.,"[{'name': 'movie_name', 'description': 'the name of the movie', 'datatype': 'String'}, {'name': 'showtime', 'description': 'the showtime for which tickets are booked', 'datatype': 'String'}, {'name': 'number_of_tickets', 'description': 'the number of tickets to be booked', 'datatype': 'Integer'}]","[{'name': 'booking_status', 'description': 'the status of the booking', 'datatype': 'String'}]",,
FindEventCity,FindEventCity(event_name) -> city name,442,This API is to find the city where a specific event will take place.,This API is to find the city where a specific event will take place.,"[{'name': 'event_name', 'description': 'the name of the event', 'datatype': 'String'}]","[{'name': 'city name', 'description': 'the name of the city where the event will take place', 'datatype': 'String'}]",,
FindEventDate,FindEventDate(event_name) -> date,443,This API is to find the date when a specific event will take place.,This API is to find the date when a specific event will take place.,"[{'name': 'event_name', 'description': 'the name of the event', 'datatype': 'String'}]","[{'name': 'date', 'description': 'the date when the event will take place', 'datatype': 'Date'}]",,
FindRoomType,"FindRoomType(hotelname, guestNumber) -> room type",444,This API is used to find suitable room type in a hotel for specific number of guests.,This API is used to find suitable room type in a hotel for specific number of guests.,"[{'name': 'hotelname', 'description': 'the name of the hotel', 'datatype': 'String'}, {'name': 'guestNumber', 'description': 'the number of guests', 'datatype': 'Integer'}]","[{'name': 'room type', 'description': 'the type of the hotel room', 'datatype': 'String'}]",,
CreateAppointment,"CreateAppointment(doctorId, patientId, date, time) -> appointment status",445,This API is used to create an appointment with a specific doctor for a specific patient at a certain date and time.,This API is used to create an appointment with a specific doctor for a specific patient at a certain date and time.,"[{'name': 'doctorId', 'description': 'the ID of the doctor', 'datatype': 'Integer'}, {'name': 'patientId', 'description': 'the ID of the patient', 'datatype': 'Integer'}, {'name': 'date', 'description': 'the date of the appointment', 'datatype': 'String'}, {'name': 'time', 'description': 'the time of the appointment', 'datatype': 'String'}]","[{'name': 'appointment status', 'description': 'the status of the appointment', 'datatype': 'String'}]",,
FindPatient,FindPatient(patientname) -> patient id,446,This API is used to find a patient based on patient name.,This API is used to find a patient based on patient name.,"[{'name': 'patientname', 'description': 'the name of the patient', 'datatype': 'String'}]","[{'name': 'patient id', 'description': 'the ID of the patient', 'datatype': 'Integer'}]",,
GetLunchRecommendation,GetLunchRecommendation(weather_info) -> food_recommendation,447,This API is to get lunch recommendation based on the weather.,This API is to get lunch recommendation based on the weather.,"[{'name': 'weather_info', 'description': 'the weather information', 'datatype': 'String'}]","[{'name': 'food_recommendation', 'description': 'the lunch recommendation', 'datatype': 'String'}]",,
FindShowtime,"FindShowtime(movie_name, location, date) -> showtime",448,This API is to find the showtime for a specific movie in a given location on a specific date.,This API is to find the showtime for a specific movie in a given location on a specific date.,"[{'name': 'movie_name', 'description': 'the name of the movie', 'datatype': 'String'}, {'name': 'location', 'description': 'the location where the movie is available', 'datatype': 'String'}, {'name': 'date', 'description': 'the date for which the showtime is required', 'datatype': 'String'}]","[{'name': 'showtime', 'description': 'the showtime of the movie', 'datatype': 'String'}]",,
BookMovieTicket,"BookMovieTicket(movie_name, showtime, number_of_tickets) -> booking confirmation",449,This API is to book movie tickets for a specific movie at a specific showtime.,This API is to book movie tickets for a specific movie at a specific showtime.,"[{'name': 'movie_name', 'description': 'the name of the movie', 'datatype': 'String'}, {'name': 'showtime', 'description': 'the showtime of the movie', 'datatype': 'String'}, {'name': 'number_of_tickets', 'description': 'the number of tickets to be booked', 'datatype': 'Integer'}]","[{'name': 'booking confirmation', 'description': 'the confirmation of the booking', 'datatype': 'String'}]",,
FetchUserDetails,FetchUserDetails(user_id) -> user_details,450,This API is to fetch user details based on the user_id.,This API is to fetch user details based on the user_id.,"[{'name': 'user_id', 'description': 'the ID of the user', 'datatype': 'String'}]","[{'name': 'user_details', 'description': 'the details of the user', 'datatype': 'Object'}]",,
GenerateOrderSummary,GenerateOrderSummary(order_id) -> order_summary,451,This API is to generate a summary of the order using the order_id.,This API is to generate a summary of the order using the order_id.,"[{'name': 'order_id', 'description': 'the ID of the order', 'datatype': 'String'}]","[{'name': 'order_summary', 'description': 'the summary of the order', 'datatype': 'Object'}]",,
EmailUser,"EmailUser(user_details, message) -> email_status",452,This API is to send an email to a user.,This API is to send an email to a user.,"[{'name': 'user_details', 'description': 'the details of the user', 'datatype': 'Object'}, {'name': 'message', 'description': 'the message to be sent', 'datatype': 'String'}]","[{'name': 'email_status', 'description': 'the status of the email', 'datatype': 'String'}]",,
FoodOrder,"FoodOrder(user_ID, restaurant_ID, food_item) -> order_status",453,This API is to order food.,This API is to order food.,"[{'name': 'user_ID', 'description': 'the ID of the user', 'datatype': 'Integer'}, {'name': 'restaurant_ID', 'description': 'the ID of the restaurant', 'datatype': 'Integer'}, {'name': 'food_item', 'description': 'the name of the food item', 'datatype': 'String'}]","[{'name': 'order_status', 'description': 'the status of the food order', 'datatype': 'String'}]",,
Bookname2ISBN,Bookname2ISBN(book_name) -> isbn,454,This API is to convert book name to book ISBN.,This API is to convert book name to book ISBN.,"[{'name': 'book_name', 'description': 'the name of the book', 'datatype': 'String'}]","[{'name': 'isbn', 'description': 'the ISBN of the book', 'datatype': 'String'}]",,
Library2ID,Library2ID(library_name) -> library_id,455,This API is to convert library name to library ID.,This API is to convert library name to library ID.,"[{'name': 'library_name', 'description': 'the name of the library', 'datatype': 'String'}]","[{'name': 'library_id', 'description': 'the ID of the library', 'datatype': 'Integer'}]",,
Storename2ID,Storename2ID(store_name) -> store_ID,456,This API is to convert store name to store ID.,This API is to convert store name to store ID.,"[{'name': 'store_name', 'description': 'the name of the store', 'datatype': 'String'}]","[{'name': 'store_ID', 'description': 'the ID of the store', 'datatype': 'Integer'}]",,
AddProductToStore,"AddProductToStore(product_ID, store_ID, quantity) -> status",457,This API is to add a product to a store.,This API is to add a product to a store.,"[{'name': 'product_ID', 'description': 'the ID of the product', 'datatype': 'Integer'}, {'name': 'store_ID', 'description': 'the ID of the store', 'datatype': 'Integer'}, {'name': 'quantity', 'description': 'the quantity of the product to add', 'datatype': 'Integer'}]","[{'name': 'status', 'description': 'the status of the operation', 'datatype': 'String'}]",,
BookTitle2ISBN,BookTitle2ISBN(book_title) -> ISBN,458,This API is to convert book title to book ISBN.,This API is to convert book title to book ISBN.,"[{'name': 'book_title', 'description': 'the title of the book', 'datatype': 'String'}]","[{'name': 'ISBN', 'description': 'the ISBN of the book', 'datatype': 'String'}]",,
BuyBook,"BuyBook(user_ID, ISBN) -> purchase_status",459,This API is to purchase a book for a user.,This API is to purchase a book for a user.,"[{'name': 'user_ID', 'description': 'the ID of the user', 'datatype': 'String'}, {'name': 'ISBN', 'description': 'the ISBN of the book', 'datatype': 'String'}]","[{'name': 'purchase_status', 'description': 'the status of the purchase', 'datatype': 'String'}]",,
Recipename2ID,Recipename2ID(recipe_name) -> recipe_ID,460,This API is to convert recipe name to recipe ID.,This API is to convert recipe name to recipe ID.,"[{'name': 'recipe_name', 'description': 'the name of the recipe', 'datatype': 'String'}]","[{'name': 'recipe_ID', 'description': 'the ID of the recipe', 'datatype': 'Integer'}]",,
Ingredientname2ID,Ingredientname2ID(ingredient_name) -> ingredient_ID,461,This API is to convert ingredient name to ingredient ID.,This API is to convert ingredient name to ingredient ID.,"[{'name': 'ingredient_name', 'description': 'the name of the ingredient', 'datatype': 'String'}]","[{'name': 'ingredient_ID', 'description': 'the ID of the ingredient', 'datatype': 'Integer'}]",,
GetRecipe,"GetRecipe(Recipe_ID, Ingredient_ID) -> recipe",462,This API is to get a recipe.,This API is to get a recipe.,"[{'name': 'recipe_ID', 'description': 'the ID of the recipe', 'datatype': 'Integer'}, {'name': 'ingredient_ID', 'description': 'the ID of the ingredient', 'datatype': 'Integer'}]","[{'name': 'recipe', 'description': 'the recipe details', 'datatype': 'String'}]",,
