name,format,Id,description,summary,input_parameters_with_datatype,output_parameters_with_datatype,url,method
MovieRatingAPI,MovieRatingAPI(Moviename) -> MovieRating,584,This API provides the rating for a specific movie.,This API provides the rating for a specific movie.,"[{'name': 'Moviename', 'description': 'the name of the movie', 'datatype': 'String'}]","[{'name': 'MovieRating', 'description': 'the rating of the movie', 'datatype': 'Float'}]",,
MovieSuggestionAPI,"MovieSuggestionAPI(MovieList, MovieRating) -> MovieSuggestion",585,This API suggests a movie to watch based on the movie list and highest movie rating.,This API suggests a movie to watch based on the movie list and highest movie rating.,"[{'name': 'MovieList', 'description': 'a list of movies', 'datatype': 'List'}, {'name': 'MovieRating', 'description': 'the rating of the movie', 'datatype': 'Float'}]","[{'name': 'MovieSuggestion', 'description': 'the suggested movie', 'datatype': 'String'}]",,
ConvertToCurrency,"ConvertToCurrency(Price, Currency) -> Amount",586,This API converts a book price into a specific currency.,This API converts a book price into a specific currency.,"[{'name': 'Price', 'description': 'the price of the book', 'datatype': 'Float'}, {'name': 'Currency', 'description': 'the target currency', 'datatype': 'String'}]","[{'name': 'Amount', 'description': 'the converted price in the target currency', 'datatype': 'Float'}]",,
PageCount,PageCount(Title) -> Pages,587,This API fetches the number of pages in a book using its title.,This API fetches the number of pages in a book using its title.,"[{'name': 'Title', 'description': 'the title of the book', 'datatype': 'String'}]","[{'name': 'Pages', 'description': 'the number of pages in the book', 'datatype': 'Integer'}]",,
ReadingTime,ReadingTime(Pages) -> Time,588,This API estimates the time it will take to read a book based on the number of pages.,This API estimates the time it will take to read a book based on the number of pages.,"[{'name': 'Pages', 'description': 'the number of pages in the book', 'datatype': 'Integer'}]","[{'name': 'Time', 'description': 'the estimated time to read the book', 'datatype': 'String'}]",,
OutfitSuggestion,OutfitSuggestion(WeatherCondition) -> Outfit,589,This API suggests an outfit based on the weather condition.,This API suggests an outfit based on the weather condition.,"[{'name': 'WeatherCondition', 'description': 'the current weather condition', 'datatype': 'String'}]","[{'name': 'Outfit', 'description': 'the suggested outfit', 'datatype': 'String'}]",,
Shop,Shop(Outfit) -> Stores,590,This API finds stores that have the suggested outfit in stock.,This API finds stores that have the suggested outfit in stock.,"[{'name': 'Outfit', 'description': 'the suggested outfit', 'datatype': 'String'}]","[{'name': 'Stores', 'description': 'the stores that have the suggested outfit in stock', 'datatype': 'List'}]",,
AlbumArtist,AlbumArtist(album_name) -> artist,591,This API is to query the artist who created a certain album.,This API is to query the artist who created a certain album.,"[{'name': 'album_name', 'description': 'the name of the album', 'datatype': 'String'}]","[{'name': 'artist', 'description': 'the artist who created the album', 'datatype': 'String'}]",,
ArtistGenre,ArtistGenre(artist_name) -> genre,592,This API is to query the genre of a certain artist.,This API is to query the genre of a certain artist.,"[{'name': 'artist_name', 'description': 'the name of the artist', 'datatype': 'String'}]","[{'name': 'genre', 'description': 'the genre of the artist', 'datatype': 'String'}]",,
MusicRecommend,"MusicRecommend(artist, genre, year) -> music",593,"This API recommends music based on the certain artist, genre and year.","This API recommends music based on the certain artist, genre and year.","[{'name': 'artist', 'description': 'the artist of the song', 'datatype': 'String'}, {'name': 'genre', 'description': 'the genre of the song', 'datatype': 'String'}, {'name': 'year', 'description': 'the year of the song', 'datatype': 'Integer'}]","[{'name': 'music', 'description': 'the recommended music', 'datatype': 'String'}]",,
BookAuthor,BookAuthor(book_name) -> author,594,This API is to query the author information of a book.,This API is to query the author information of a book.,"[{'name': 'book_name', 'description': 'the name of the book', 'datatype': 'String'}]","[{'name': 'author', 'description': 'the author of the book', 'datatype': 'String'}]",,
AuthorBirthplace,AuthorBirthplace(author) -> birthplace,595,This API retrieves the birthplace of a specific author.,This API retrieves the birthplace of a specific author.,"[{'name': 'author', 'description': 'the name of the author', 'datatype': 'String'}]","[{'name': 'birthplace', 'description': 'the birthplace of the author', 'datatype': 'String'}]",,
FoodCuisine,FoodCuisine(food_name) -> cuisine,596,This API retrieves the cuisine of a particular food.,This API retrieves the cuisine of a particular food.,"[{'name': 'food_name', 'description': 'the name of the food', 'datatype': 'String'}]","[{'name': 'cuisine', 'description': 'the cuisine of the food', 'datatype': 'String'}]",,
CuisineOrigin,CuisineOrigin(cuisine) -> country,597,This API provides the origin country of a specific cuisine.,This API provides the origin country of a specific cuisine.,"[{'name': 'cuisine', 'description': 'the cuisine', 'datatype': 'String'}]","[{'name': 'country', 'description': 'the origin country of the cuisine', 'datatype': 'String'}]",,
CountryCapital,CountryCapital(country) -> capital,598,This API retrieves the capital city of a specific country.,This API retrieves the capital city of a specific country.,"[{'name': 'country', 'description': 'the country', 'datatype': 'String'}]","[{'name': 'capital', 'description': 'the capital city of the country', 'datatype': 'String'}]",,
UserSearch,UserSearch(username) -> user_details,599,This API is used to find the details of the user.,This API is used to find the details of the user.,"[{'name': 'username', 'description': 'the username of the user', 'datatype': 'String'}]","[{'name': 'user_details', 'description': 'the details of the user', 'datatype': 'Object'}]",,
OrderHistory,OrderHistory(user_id) -> order_history,600,This API is used to find out the order history of a user.,This API is used to find out the order history of a user.,"[{'name': 'user_id', 'description': 'the ID of the user', 'datatype': 'Integer'}]","[{'name': 'order_history', 'description': 'the order history of the user', 'datatype': 'List'}]",,
OrderSearch,OrderSearch(order_id) -> order_details,601,This API is used to find the details of the specific order.,This API is used to find the details of the specific order.,"[{'name': 'order_id', 'description': 'the ID of the order', 'datatype': 'Integer'}]","[{'name': 'order_details', 'description': 'the details of the order', 'datatype': 'Object'}]",,
UserProfile,UserProfile(username) -> user profile,602,This API is used to find user's profile.,This API is used to find user's profile.,"[{'name': 'username', 'description': 'the username of the user', 'datatype': 'String'}]","[{'name': 'user profile', 'description': 'the profile of the user', 'datatype': 'Object'}]",,
CalculateCalorie,CalculateCalorie(food) -> calorie,603,This API calculates calorie of a given food.,This API calculates calorie of a given food.,"[{'name': 'food', 'description': 'the name of the food', 'datatype': 'String'}]","[{'name': 'calorie', 'description': 'the calorie count of the food', 'datatype': 'Integer'}]",,
MealSuggestion,"MealSuggestion(calorie, dietary_restrictions) -> suggested meals",604,This API suggests meals based on calorie count and dietary restrictions.,This API suggests meals based on calorie count and dietary restrictions.,"[{'name': 'calorie', 'description': 'the calorie count', 'datatype': 'Integer'}, {'name': 'dietary_restrictions', 'description': 'the dietary restrictions', 'datatype': 'String'}]","[{'name': 'suggested meals', 'description': 'the suggested meals', 'datatype': 'List'}]",,
GetCurrentWeather,GetCurrentWeather(location) -> current_weather,605,This API retrieves the current weather for a given location.,This API retrieves the current weather for a given location.,"[{'name': 'location', 'description': 'the location for which to retrieve the current weather', 'datatype': 'String'}]","[{'name': 'current_weather', 'description': 'the current weather for the given location', 'datatype': 'String'}]",,
CompareWeather,"CompareWeather(current_weather, weather_forecast) -> weather_comparison",606,This API compares the current weather with the forecasted weather.,This API compares the current weather with the forecasted weather.,"[{'name': 'current_weather', 'description': 'the current weather for a location', 'datatype': 'String'}, {'name': 'weather_forecast', 'description': 'the weather forecast for the next seven days for a location', 'datatype': 'String'}]","[{'name': 'weather_comparison', 'description': 'the comparison result of the current weather with the forecasted weather', 'datatype': 'String'}]",,
RestaurantRecommend,"RestaurantRecommend(city, cuisine, weather) -> restaurants",607,This API recommends restaurants in a certain city that serve a particular cuisine depending on the weather.,This API recommends restaurants in a certain city that serve a particular cuisine depending on the weather.,"[{'name': 'city', 'description': 'the name of the city', 'datatype': 'String'}, {'name': 'cuisine', 'description': 'the type of cuisine', 'datatype': 'String'}, {'name': 'weather', 'description': 'the weather forecast information', 'datatype': 'String'}]","[{'name': 'restaurants', 'description': 'the recommended restaurants', 'datatype': 'String'}]",,
EventSearch,"EventSearch(city, date) -> event",608,This API provides details on events happening in the specified city on a given date.,This API provides details on events happening in the specified city on a given date.,"[{'name': 'city', 'description': 'the name of the city', 'datatype': 'String'}, {'name': 'date', 'description': 'the date of the event', 'datatype': 'Date'}]","[{'name': 'event', 'description': 'the details of the event', 'datatype': 'Object'}]",,
CityGuide,"CityGuide(restaurant, event) -> guide",609,This API creates a guide containing restaurant and event information.,This API creates a guide containing restaurant and event information.,"[{'name': 'restaurant', 'description': 'the details of the restaurant', 'datatype': 'Object'}, {'name': 'event', 'description': 'the details of the event', 'datatype': 'Object'}]","[{'name': 'guide', 'description': 'the guide containing restaurant and event information', 'datatype': 'Object'}]",,
TravelPlan,"TravelPlan(weather, restaurant) -> plan",610,This API generates a travel plan based on the weather and restaurant recommendation.,This API generates a travel plan based on the weather and restaurant recommendation.,"[{'name': 'weather', 'description': 'the weather forecast', 'datatype': 'String'}, {'name': 'restaurant', 'description': 'the recommended restaurant', 'datatype': 'String'}]","[{'name': 'plan', 'description': 'the generated travel plan', 'datatype': 'String'}]",,
NewsHeadlines,NewsHeadlines(company) -> news,611,This API gives the most recent news headlines about the specified company.,This API gives the most recent news headlines about the specified company.,"[{'name': 'company', 'description': 'the name of the company', 'datatype': 'String'}]","[{'name': 'news', 'description': 'the most recent news headlines about the company', 'datatype': 'String'}]",,
InvestmentStrategy,"InvestmentStrategy(stockPrice, news) -> strategy",612,This API generates an investment strategy based on the stock price and news headlines.,This API generates an investment strategy based on the stock price and news headlines.,"[{'name': 'stockPrice', 'description': ""the current price of the company's stock"", 'datatype': 'Float'}, {'name': 'news', 'description': 'the most recent news headlines about the company', 'datatype': 'String'}]","[{'name': 'strategy', 'description': 'the generated investment strategy', 'datatype': 'String'}]",,
RestaurantRating,"RestaurantRating(city, restaurant) -> rating",613,This API gives the current rating of a restaurant in a specified city.,This API gives the current rating of a restaurant in a specified city.,"[{'name': 'city', 'description': 'the name of the city', 'datatype': 'String'}, {'name': 'restaurant', 'description': 'the name of the restaurant', 'datatype': 'String'}]","[{'name': 'rating', 'description': 'the current rating of the restaurant', 'datatype': 'Float'}]",,
RestaurantPriceRange,"RestaurantPriceRange(city, restaurant) -> priceRange",614,This API gives the price range for a restaurant in the specified city.,This API gives the price range for a restaurant in the specified city.,"[{'name': 'city', 'description': 'the name of the city', 'datatype': 'String'}, {'name': 'restaurant', 'description': 'the name of the restaurant', 'datatype': 'String'}]","[{'name': 'priceRange', 'description': 'the price range of the restaurant', 'datatype': 'String'}]",,
TransportFare,"TransportFare(city, destination) -> fare",615,This API gives the one-way transportation fare to the destination in a specified city.,This API gives the one-way transportation fare to the destination in a specified city.,"[{'name': 'city', 'description': 'the name of the city', 'datatype': 'String'}, {'name': 'destination', 'description': 'the destination', 'datatype': 'String'}]","[{'name': 'fare', 'description': 'the one-way transportation fare', 'datatype': 'Float'}]",,
TotalDinnerCost,"TotalDinnerCost(restaurantPriceRange, transportFare) -> totalCost",616,This API calculates the total cost of dinner including the price range of the restaurant and transportation fare.,This API calculates the total cost of dinner including the price range of the restaurant and transportation fare.,"[{'name': 'restaurantPriceRange', 'description': 'the price range of the restaurant', 'datatype': 'String'}, {'name': 'transportFare', 'description': 'the one-way transportation fare', 'datatype': 'Float'}]","[{'name': 'totalCost', 'description': 'the total cost of dinner', 'datatype': 'Float'}]",,
ClothingSuggestion,ClothingSuggestion(weather) -> clothes,617,This API suggests suitable clothing based on the weather.,This API suggests suitable clothing based on the weather.,"[{'name': 'weather', 'description': 'the weather forecast', 'datatype': 'String'}]","[{'name': 'clothes', 'description': 'the suggested clothing based on the weather', 'datatype': 'String'}]",,
FashionStore,"FashionStore(clothes, location) -> price",618,This API gives the price of suggested clothing in the local stores of the given location.,This API gives the price of suggested clothing in the local stores of the given location.,"[{'name': 'clothes', 'description': 'the suggested clothing', 'datatype': 'String'}, {'name': 'location', 'description': 'the location for which price is required', 'datatype': 'String'}]","[{'name': 'price', 'description': 'the price of suggested clothing in the local stores', 'datatype': 'Float'}]",,
DistanceCalculator,"DistanceCalculator(origin, destination) -> distance",619,This API calculates the distance between two locations.,This API calculates the distance between two locations.,"[{'name': 'origin', 'description': 'the starting location', 'datatype': 'String'}, {'name': 'destination', 'description': 'the destination location', 'datatype': 'String'}]","[{'name': 'distance', 'description': 'the calculated distance', 'datatype': 'Float'}]",,
TrafficEstimator,TrafficEstimator(distance) -> traffic,620,This API estimates the traffic based on the distance.,This API estimates the traffic based on the distance.,"[{'name': 'distance', 'description': 'the distance between two locations', 'datatype': 'Float'}]","[{'name': 'traffic', 'description': 'the estimated traffic', 'datatype': 'String'}]",,
TimeCalculator,"TimeCalculator(traffic, modeOfTransport) -> time",621,This API calculates the time taken to travel based on the traffic and mode of transport.,This API calculates the time taken to travel based on the traffic and mode of transport.,"[{'name': 'traffic', 'description': 'the estimated traffic', 'datatype': 'String'}, {'name': 'modeOfTransport', 'description': 'the mode of transport', 'datatype': 'String'}]","[{'name': 'time', 'description': 'the calculated time taken to travel', 'datatype': 'String'}]",,
CalculateTime,"CalculateTime(distance, speed) -> time",622,This API calculates the travel time based on distance and speed.,This API calculates the travel time based on distance and speed.,"[{'name': 'distance', 'description': 'the distance of the journey', 'datatype': 'Float'}, {'name': 'speed', 'description': 'the average speed of the journey', 'datatype': 'Integer'}]","[{'name': 'time', 'description': 'the estimated travel time', 'datatype': 'Float'}]",,
RoutePlanner,"RoutePlanner(origin, destination, distance, time) -> route",623,This API provides a travel route plan from origin to destination with distance and estimated time.,This API provides a travel route plan from origin to destination with distance and estimated time.,"[{'name': 'origin', 'description': 'the starting point of the journey', 'datatype': 'String'}, {'name': 'destination', 'description': 'the destination point of the journey', 'datatype': 'String'}, {'name': 'distance', 'description': 'the distance of the journey', 'datatype': 'Float'}, {'name': 'time', 'description': 'the estimated travel time', 'datatype': 'Float'}]","[{'name': 'route', 'description': 'the travel route plan', 'datatype': 'String'}]",,
UserLocation,UserLocation(userID) -> location,624,This API gets the location of a specific user.,This API gets the location of a specific user.,"[{'name': 'userID', 'description': 'the ID of the user', 'datatype': 'Integer'}]","[{'name': 'location', 'description': 'the location of the user', 'datatype': 'String'}]",,
WeatherCheck,WeatherCheck(location) -> weather,625,This API checks the weather of a specific location.,This API checks the weather of a specific location.,"[{'name': 'location', 'description': 'the location to check the weather', 'datatype': 'String'}]","[{'name': 'weather', 'description': 'the weather of the location', 'datatype': 'String'}]",,
DressSuggestion,DressSuggestion(weather) -> dress,626,This API suggests a dress based on the weather.,This API suggests a dress based on the weather.,"[{'name': 'weather', 'description': 'the weather to suggest a dress', 'datatype': 'String'}]","[{'name': 'dress', 'description': 'the suggested dress based on the weather', 'datatype': 'String'}]",,
OutdoorActivityRecommend,"OutdoorActivityRecommend(city, weather) -> activity",627,This API recommends outdoor activities based on the weather and city.,This API recommends outdoor activities based on the weather and city.,"[{'name': 'city', 'description': 'the name of the city', 'datatype': 'String'}, {'name': 'weather', 'description': 'the weather forecast for the city', 'datatype': 'String'}]","[{'name': 'activity', 'description': 'the recommended outdoor activity based on the weather and city', 'datatype': 'String'}]",,
BusSchedule,BusSchedule(bus_number) -> bus_info,628,This API is to query the schedule and route details of a specific bus.,This API is to query the schedule and route details of a specific bus.,"[{'name': 'bus_number', 'description': 'the number of the bus', 'datatype': 'String'}]","[{'name': 'bus_info', 'description': 'the schedule and route details of the bus', 'datatype': 'String'}]",,
ParkRecommend,"ParkRecommend(city, weather) -> parks",629,This API recommends parks in a city that are suitable for particular weather.,This API recommends parks in a city that are suitable for particular weather.,"[{'name': 'city', 'description': 'the name of the city', 'datatype': 'String'}, {'name': 'weather', 'description': 'the weather condition', 'datatype': 'String'}]","[{'name': 'parks', 'description': 'the recommended parks in the city', 'datatype': 'List'}]",,
MenuGetter,MenuGetter(restaurant) -> menu,630,This API is used to get the menu from a specified restaurant.,This API is used to get the menu from a specified restaurant.,"[{'name': 'restaurant', 'description': 'the name of the restaurant', 'datatype': 'String'}]","[{'name': 'menu', 'description': 'the menu of the restaurant', 'datatype': 'String'}]",,
FootballTeamInfo,FootballTeamInfo(team_name) -> team_info,631,This API is to query the detailed information of the football team.,This API is to query the detailed information of the football team.,"[{'name': 'team_name', 'description': 'the name of the football team', 'datatype': 'String'}]","[{'name': 'team_info', 'description': 'the detailed information of the football team', 'datatype': 'String'}]",,
GameSchedule,GameSchedule(team_info) -> game_schedule,632,This API provides a schedule for the team's games based on the team information.,This API provides a schedule for the team's games based on the team information.,"[{'name': 'team_info', 'description': 'the detailed information of the football team', 'datatype': 'String'}]","[{'name': 'game_schedule', 'description': ""the schedule for the team's games"", 'datatype': 'String'}]",,
TicketPrice,TicketPrice(game_schedule) -> ticket_price,633,This API calculates the ticket price based on the game schedule.,This API calculates the ticket price based on the game schedule.,"[{'name': 'game_schedule', 'description': ""the schedule for the team's games"", 'datatype': 'String'}]","[{'name': 'ticket_price', 'description': ""the price for watching the team's games"", 'datatype': 'Float'}]",,
GetMovieRatings,GetMovieRatings(movie) -> rating_info,634,This API returns the rating information of a specific movie.,This API returns the rating information of a specific movie.,"[{'name': 'movie', 'description': 'the name of the movie', 'datatype': 'String'}]","[{'name': 'rating_info', 'description': 'the rating information of the movie', 'datatype': 'String'}]",,
FindMovieGenre,FindMovieGenre(movie) -> genre,635,This API finds out the genre of a specific movie.,This API finds out the genre of a specific movie.,"[{'name': 'movie', 'description': 'the name of the movie', 'datatype': 'String'}]","[{'name': 'genre', 'description': 'the genre of the movie', 'datatype': 'String'}]",,
BookDetails,BookDetails(title) -> bookInfo,636,This API returns details about a certain book.,This API returns details about a certain book.,"[{'name': 'title', 'description': 'the title of the book', 'datatype': 'String'}]","[{'name': 'bookInfo', 'description': 'the information about the book', 'datatype': 'Object'}]",,
AuthorInformation,AuthorInformation(author) -> authorBio,637,This API provides information about an author.,This API provides information about an author.,"[{'name': 'author', 'description': 'the name of the author', 'datatype': 'String'}]","[{'name': 'authorBio', 'description': 'the information about the author', 'datatype': 'Object'}]",,
ReadingSuggestion,"ReadingSuggestion(bookInfo, authorBio) -> readingPlan",638,This API generates a reading plan based on book and author information.,This API generates a reading plan based on book and author information.,"[{'name': 'bookInfo', 'description': 'the information about the book', 'datatype': 'Object'}, {'name': 'authorBio', 'description': 'the information about the author', 'datatype': 'Object'}]","[{'name': 'readingPlan', 'description': 'the generated reading plan', 'datatype': 'Object'}]",,
HotelReservation,"HotelReservation(city, date) -> hotelInfo",639,This API returns information about hotel reservations in a certain city on a particular date.,This API returns information about hotel reservations in a certain city on a particular date.,"[{'name': 'city', 'description': 'the name of the city', 'datatype': 'String'}, {'name': 'date', 'description': 'the date of the hotel reservation', 'datatype': 'String'}]","[{'name': 'hotelInfo', 'description': 'information about hotel reservations', 'datatype': 'String'}]",,
EventSuggestions,"EventSuggestions(city, date) -> eventDetails",640,This API provides suggestions for events happening in a certain city on a specific date.,This API provides suggestions for events happening in a certain city on a specific date.,"[{'name': 'city', 'description': 'the name of the city', 'datatype': 'String'}, {'name': 'date', 'description': 'the date of the event suggestions', 'datatype': 'String'}]","[{'name': 'eventDetails', 'description': 'suggestions for events happening in the city', 'datatype': 'String'}]",,
FuelConsumption,"FuelConsumption(flightID, distance) -> fuelAmount",641,This API estimates the fuel amount consumed by a certain flight on a certain distance.,This API estimates the fuel amount consumed by a certain flight on a certain distance.,"[{'name': 'flightID', 'description': 'the ID of the flight', 'datatype': 'Integer'}, {'name': 'distance', 'description': 'the distance of the flight', 'datatype': 'Float'}]","[{'name': 'fuelAmount', 'description': 'the estimated fuel amount consumed by the flight', 'datatype': 'Float'}]",,
OutfitStoreSearch,"OutfitStoreSearch(clothing, city) -> store",642,This API searches for stores that sell the recommended clothing in the city.,This API searches for stores that sell the recommended clothing in the city.,"[{'name': 'clothing', 'description': 'the recommended clothing', 'datatype': 'String'}, {'name': 'city', 'description': 'the name of the city', 'datatype': 'String'}]","[{'name': 'store', 'description': 'the stores that sell the recommended clothing', 'datatype': 'String'}]",,
