name,format,Id,description,summary,input_parameters_with_datatype,output_parameters_with_datatype,url,method
GetLocationCoordinates,"GetLocationCoordinates(city) -> (latitude, longitude)",244,This API returns the geographical coordinates (latitude and longitude) of a specified city.,This API returns the geographical coordinates (latitude and longitude) of a specified city.,"[{'name': 'city', 'description': 'the name of the city', 'datatype': 'String'}]","[{'name': 'latitude', 'description': 'the latitude coordinate of the city', 'datatype': 'Float'}, {'name': 'longitude', 'description': 'the longitude coordinate of the city', 'datatype': 'Float'}]",,
PredictWeather,"PredictWeather(coordinates, date) -> weather conditions",245,This API provides the weather forecast for a location based on geographic coordinates on a specific date.,This API provides the weather forecast for a location based on geographic coordinates on a specific date.,"[{'name': 'coordinates', 'description': 'the geographic coordinates (latitude and longitude) of the location', 'datatype': 'Tuple (Float, Float)'}, {'name': 'date', 'description': 'the specific date for the weather forecast', 'datatype': 'String'}]","[{'name': 'weather conditions', 'description': 'the weather conditions for the specified location and date', 'datatype': 'String'}]",,
SuggestActivity,SuggestActivity(weather) -> activity,246,This API suggests an activity based on the weather conditions.,This API suggests an activity based on the weather conditions.,"[{'name': 'weather', 'description': 'the weather conditions', 'datatype': 'String'}]","[{'name': 'activity', 'description': 'the suggested activity based on the weather conditions', 'datatype': 'String'}]",,
SearchBook,SearchBook(title) -> book_id,247,This API returns the ID of a book based on a specified title.,This API returns the ID of a book based on a specified title.,"[{'name': 'title', 'description': 'the title of the book', 'datatype': 'String'}]","[{'name': 'book_id', 'description': 'the ID of the book', 'datatype': 'Integer'}]",,
GetBookReview,GetBookReview(book_id) -> review,248,This API gives a review of a book given its ID.,This API gives a review of a book given its ID.,"[{'name': 'book_id', 'description': 'the ID of the book', 'datatype': 'Integer'}]","[{'name': 'review', 'description': 'the review of the book', 'datatype': 'String'}]",,
ShareReview,"ShareReview(review, social_media_platform) -> share_status",249,This API allows the user to share a review on a specified social media platform.,This API allows the user to share a review on a specified social media platform.,"[{'name': 'review', 'description': 'the review of the book', 'datatype': 'String'}, {'name': 'social_media_platform', 'description': 'the social media platform to share the review', 'datatype': 'String'}]","[{'name': 'share_status', 'description': 'the status of the sharing', 'datatype': 'String'}]",,
GetShowtimes,"GetShowtimes(movie_title, city) -> showtime",250,This API gives the showtime for a given movie in a specific city.,This API gives the showtime for a given movie in a specific city.,"[{'name': 'movie_title', 'description': 'the title of the movie', 'datatype': 'String'}, {'name': 'city', 'description': 'the city where the showtime is requested', 'datatype': 'String'}]","[{'name': 'showtime', 'description': 'the showtime of the movie in the specified city', 'datatype': 'Time'}]",,
ReserveTickets,"ReserveTickets(showtime, number_of_tickets) -> reservation_status",251,This API allows the user to reserve a certain number of tickets for a specific showtime.,This API allows the user to reserve a certain number of tickets for a specific showtime.,"[{'name': 'showtime', 'description': 'the showtime of the movie', 'datatype': 'Time'}, {'name': 'number_of_tickets', 'description': 'the number of tickets to be reserved', 'datatype': 'Integer'}]","[{'name': 'reservation_status', 'description': 'the status of the ticket reservation', 'datatype': 'String'}]",,
LocateLibrary,LocateLibrary(city) -> library_name,252,This API provides the name of a library in the specified city.,This API provides the name of a library in the specified city.,"[{'name': 'city', 'description': 'the city name', 'datatype': 'String'}]","[{'name': 'library_name', 'description': 'the name of the library', 'datatype': 'String'}]",,
RestaurantLocator,"RestaurantLocator(city, cuisine) -> restaurant",253,This API is to find a specific restaurant by city and cuisine.,This API is to find a specific restaurant by city and cuisine.,"[{'name': 'city', 'description': 'the city where the restaurant is located', 'datatype': 'String'}, {'name': 'cuisine', 'description': 'the type of cuisine the restaurant serves', 'datatype': 'String'}]","[{'name': 'restaurant', 'description': 'the details of the restaurant', 'datatype': 'Object'}]",,
DishFinder,"DishFinder(restaurant, dish) -> dish_details",254,This API is to get information about a specific dish from a particular restaurant.,This API is to get information about a specific dish from a particular restaurant.,"[{'name': 'restaurant', 'description': 'the details of the restaurant', 'datatype': 'Object'}, {'name': 'dish', 'description': 'the name of the dish', 'datatype': 'String'}]","[{'name': 'dish_details', 'description': 'the details of the dish', 'datatype': 'Object'}]",,
FoodReview,FoodReview(dish_details) -> review,255,This API is to get reviews of a particular dish.,This API is to get reviews of a particular dish.,"[{'name': 'dish_details', 'description': 'the details of the dish', 'datatype': 'Object'}]","[{'name': 'review', 'description': 'the reviews of the dish', 'datatype': 'Object'}]",,
FoodFinder,"FoodFinder(cuisine, location) -> restaurant_name",256,This API identifies a specific restaurant serving a certain cuisine in a particular location.,This API identifies a specific restaurant serving a certain cuisine in a particular location.,"[{'name': 'cuisine', 'description': 'the type of cuisine', 'datatype': 'String'}, {'name': 'location', 'description': 'the location of the restaurant', 'datatype': 'String'}]","[{'name': 'restaurant_name', 'description': 'the name of the restaurant', 'datatype': 'String'}]",,
MenuDetails,MenuDetails(restaurant_name) -> menu,257,This API provides the menu of a specific restaurant.,This API provides the menu of a specific restaurant.,"[{'name': 'restaurant_name', 'description': 'the name of the restaurant', 'datatype': 'String'}]","[{'name': 'menu', 'description': 'the menu of the restaurant', 'datatype': 'String'}]",,
FoodIngredients,"FoodIngredients(dish_name, restaurant_name) -> ingredients",258,This API gives the ingredients of a specific dish from a certain restaurant.,This API gives the ingredients of a specific dish from a certain restaurant.,"[{'name': 'dish_name', 'description': 'the name of the dish', 'datatype': 'String'}, {'name': 'restaurant_name', 'description': 'the name of the restaurant', 'datatype': 'String'}]","[{'name': 'ingredients', 'description': 'the ingredients of the dish', 'datatype': 'String'}]",,
FindNearestBookStore,FindNearestBookStore(city) -> store_name,259,This API is to find the nearest bookstore based on the user's location.,This API is to find the nearest bookstore based on the user's location.,"[{'name': 'city', 'description': 'the city where the user is located', 'datatype': 'String'}]","[{'name': 'store_name', 'description': 'the name of the nearest bookstore', 'datatype': 'String'}]",,
GetLocalCinema,GetLocalCinema(city) -> cinema_name,260,This API is to find the local cinema based on the user's location.,This API is to find the local cinema based on the user's location.,"[{'name': 'city', 'description': 'the name of the city', 'datatype': 'String'}]","[{'name': 'cinema_name', 'description': 'the name of the cinema', 'datatype': 'String'}]",,
GetCurrentMovies,GetCurrentMovies(cinema_name) -> movie_list,261,This API is to get the list of movies currently being shown in a given cinema.,This API is to get the list of movies currently being shown in a given cinema.,"[{'name': 'cinema_name', 'description': 'the name of the cinema', 'datatype': 'String'}]","[{'name': 'movie_list', 'description': 'a list of movies currently being shown', 'datatype': 'List'}]",,
GetMovieReviews,GetMovieReviews(movie_name) -> reviews,262,This API fetches the reviews of a specific movie.,This API fetches the reviews of a specific movie.,"[{'name': 'movie_name', 'description': 'the name of the movie', 'datatype': 'String'}]","[{'name': 'reviews', 'description': 'the reviews of the movie', 'datatype': 'List'}]",,
GetRestaurantMenu,GetRestaurantMenu(restaurant_id) -> menu_id,263,This API is to get the menu from a specific restaurant.,This API is to get the menu from a specific restaurant.,"[{'name': 'restaurant_id', 'description': 'the ID of the restaurant', 'datatype': 'Integer'}]","[{'name': 'menu_id', 'description': 'the ID of the menu', 'datatype': 'Integer'}]",,
GetMovieDetails,GetMovieDetails(movie_name) -> movie_info,264,This API is to get the details of a specific movie.,This API is to get the details of a specific movie.,"[{'name': 'movie_name', 'description': 'the name of the movie', 'datatype': 'String'}]","[{'name': 'movie_info', 'description': 'the details of the movie', 'datatype': 'Object'}]",,
GetActorDetails,GetActorDetails(movie_info) -> actor_info,265,This API is to get the details of actors in a specific movie.,This API is to get the details of actors in a specific movie.,"[{'name': 'movie_info', 'description': 'the details of the movie', 'datatype': 'Object'}]","[{'name': 'actor_info', 'description': 'the details of the actors', 'datatype': 'Object'}]",,
GetMovieRecommendation,GetMovieRecommendation(actor_info) -> movie_recommendation,266,This API is to get movie recommendations based on the actors' performances.,This API is to get movie recommendations based on the actors' performances.,"[{'name': 'actor_info', 'description': 'the details of the actors', 'datatype': 'Object'}]","[{'name': 'movie_recommendation', 'description': 'the recommended movies', 'datatype': 'Object'}]",,
FindOpenHours,FindOpenHours(restaurant_info) -> open_hours,267,This API is used to find the opening hours of the selected restaurant.,This API is used to find the opening hours of the selected restaurant.,"[{'name': 'restaurant_info', 'description': 'information about the restaurant', 'datatype': 'String'}]","[{'name': 'open_hours', 'description': 'the opening hours of the restaurant', 'datatype': 'String'}]",,
MakeReservation,"MakeReservation(open_hours, number_of_people, date_time) -> reservation_info",268,This API is to make a reservation at a restaurant based on its open hours for a specific number of people at a certain date and time.,This API is to make a reservation at a restaurant based on its open hours for a specific number of people at a certain date and time.,"[{'name': 'open_hours', 'description': 'the opening hours of the restaurant', 'datatype': 'String'}, {'name': 'number_of_people', 'description': 'the number of people for the reservation', 'datatype': 'Integer'}, {'name': 'date_time', 'description': 'the date and time for the reservation', 'datatype': 'String'}]","[{'name': 'reservation_info', 'description': 'information about the reservation', 'datatype': 'String'}]",,
CheckFlights,"CheckFlights(source, destination) -> flight",269,This API checks available flights from source to destination.,This API checks available flights from source to destination.,"[{'name': 'source', 'description': 'the source location', 'datatype': 'String'}, {'name': 'destination', 'description': 'the destination location', 'datatype': 'String'}]","[{'name': 'flight', 'description': 'the available flight details', 'datatype': 'Object'}]",,
PlanItinerary,"PlanItinerary(location, interests) -> itinerary",270,This API plans an itinerary based on the location and the user's interests.,This API plans an itinerary based on the location and the user's interests.,"[{'name': 'location', 'description': 'the location for the itinerary', 'datatype': 'String'}, {'name': 'interests', 'description': ""the user's interests"", 'datatype': 'String'}, {'name': 'flight', 'description': 'the flight details', 'datatype': 'Object'}, {'name': 'hotel', 'description': 'the hotel details', 'datatype': 'Object'}]","[{'name': 'itinerary', 'description': 'the planned itinerary', 'datatype': 'Object'}]",,
FindAddress,FindAddress(contact) -> address,271,This API finds the address of a specific contact.,This API finds the address of a specific contact.,"[{'name': 'contact', 'description': 'the name of the contact', 'datatype': 'String'}]","[{'name': 'address', 'description': 'the address of the contact', 'datatype': 'String'}]",,
CheckTraffic,CheckTraffic(destination) -> traffic_condition,272,This API checks the current traffic condition to a specific destination.,This API checks the current traffic condition to a specific destination.,"[{'name': 'destination', 'description': 'the destination to check traffic condition', 'datatype': 'String'}]","[{'name': 'traffic_condition', 'description': 'the current traffic condition to the destination', 'datatype': 'String'}]",,
GetLocalEvents,"GetLocalEvents(city, date) -> events",273,This API provides a list of local events happening in a specific city on a specific date.,This API provides a list of local events happening in a specific city on a specific date.,"[{'name': 'city', 'description': 'the name of the city', 'datatype': 'String'}, {'name': 'date', 'description': 'the date for the local events', 'datatype': 'String'}]","[{'name': 'events', 'description': 'a list of local events happening in the specified city and date', 'datatype': 'List'}]",,
PlanOutdoorActivities,"PlanOutdoorActivities(weather, events) -> activities",274,This API plans outdoor activities based on the weather forecast and local events.,This API plans outdoor activities based on the weather forecast and local events.,"[{'name': 'weather', 'description': 'the weather forecast for a specific city and date', 'datatype': 'String'}, {'name': 'events', 'description': 'a list of local events happening in a specific city and date', 'datatype': 'List'}]","[{'name': 'activities', 'description': 'a list of planned outdoor activities based on the weather forecast and local events', 'datatype': 'List'}]",,
FindDoctor,"FindDoctor(specialty, location) -> doctor",275,This API is to find a doctor based on specialty and location.,This API is to find a doctor based on specialty and location.,"[{'name': 'specialty', 'description': 'the specialty of the doctor', 'datatype': 'String'}, {'name': 'location', 'description': 'the location where the doctor is located', 'datatype': 'String'}]","[{'name': 'doctor', 'description': 'the information of the doctor', 'datatype': 'Object'}]",,
GetAppointment,"GetAppointment(doctor_id, date) -> appointment",276,This API is to get an appointment with a specific doctor on a certain date.,This API is to get an appointment with a specific doctor on a certain date.,"[{'name': 'doctor_id', 'description': 'the ID of the doctor', 'datatype': 'Integer'}, {'name': 'date', 'description': 'the date of the appointment', 'datatype': 'Date'}]","[{'name': 'appointment', 'description': 'the information of the appointment', 'datatype': 'Object'}]",,
ConfirmAppointment,ConfirmAppointment(appointment_id) -> confirmation,277,This API is to confirm a specific appointment.,This API is to confirm a specific appointment.,"[{'name': 'appointment_id', 'description': 'the ID of the appointment', 'datatype': 'Integer'}]","[{'name': 'confirmation', 'description': 'the confirmation status of the appointment', 'datatype': 'String'}]",,
BookReservation,"BookReservation(restaurantname, partySize, time) -> reservationStatus",278,This API is to book a reservation at a specific restaurant for a specific party size and time.,This API is to book a reservation at a specific restaurant for a specific party size and time.,"[{'name': 'restaurantname', 'description': 'the name of the specific restaurant', 'datatype': 'String'}, {'name': 'partySize', 'description': 'the size of the party', 'datatype': 'Integer'}, {'name': 'time', 'description': 'the specific time for the reservation', 'datatype': 'Time'}]","[{'name': 'reservationStatus', 'description': 'the status of the reservation', 'datatype': 'String'}]",,
PlanDay,"PlanDay(weatherForecast, clothingRecommendation) -> dayPlan",279,This API is to plan the day's activities and outfits based on the weather and clothing recommendations.,This API is to plan the day's activities and outfits based on the weather and clothing recommendations.,"[{'name': 'weatherForecast', 'description': 'the weather forecast for planning the day', 'datatype': 'String'}, {'name': 'clothingRecommendation', 'description': 'the clothing recommendations for planning the day', 'datatype': 'String'}]","[{'name': 'dayPlan', 'description': ""the plan for the day's activities and outfits"", 'datatype': 'String'}]",,
FindAccommodation,"FindAccommodation(destination, budget) -> accommodation",280,This API is to find accommodation in the destination within the specified budget.,This API is to find accommodation in the destination within the specified budget.,"[{'name': 'destination', 'description': 'the destination location', 'datatype': 'String'}, {'name': 'budget', 'description': 'the budget for accommodation', 'datatype': 'Float'}]","[{'name': 'accommodation', 'description': 'the found accommodation', 'datatype': 'String'}]",,
CreateTravelPlan,"CreateTravelPlan(flight, accommodation) -> travelPlan",281,This API is to create a travel plan including flight and accommodation.,This API is to create a travel plan including flight and accommodation.,"[{'name': 'flight', 'description': 'the booked flight', 'datatype': 'String'}, {'name': 'accommodation', 'description': 'the found accommodation', 'datatype': 'String'}]","[{'name': 'travelPlan', 'description': 'the created travel plan', 'datatype': 'String'}]",,
GetCurrentTemperature,GetCurrentTemperature(city) -> temperature,282,This API is to get the current temperature for a specific city.,This API is to get the current temperature for a specific city.,"[{'name': 'city', 'description': 'the name of the city', 'datatype': 'String'}]","[{'name': 'temperature', 'description': 'the current temperature of the city', 'datatype': 'Float'}]",,
DetermineTemperatureType,DetermineTemperatureType(temperature) -> temperatureType,283,"This API is to determine the type of temperature (Hot, Mild, Cold) based on the current temperature.","This API is to determine the type of temperature (Hot, Mild, Cold) based on the current temperature.","[{'name': 'temperature', 'description': 'the current temperature', 'datatype': 'Float'}]","[{'name': 'temperatureType', 'description': 'the type of temperature (Hot, Mild, Cold)', 'datatype': 'String'}]",,
SuggestClothingOptions,"SuggestClothingOptions(temperatureType, gender) -> clothingOptions",284,This API is to suggest clothing options based on the temperature type and gender.,This API is to suggest clothing options based on the temperature type and gender.,"[{'name': 'temperatureType', 'description': 'the type of temperature (Hot, Mild, Cold)', 'datatype': 'String'}, {'name': 'gender', 'description': 'the gender of the person', 'datatype': 'String'}]","[{'name': 'clothingOptions', 'description': 'the suggested clothing options', 'datatype': 'List'}]",,
GetHealthInformation,"GetHealthInformation(age, gender) -> HealthInformation",285,This API provides general health information based on age and gender.,This API provides general health information based on age and gender.,"[{'name': 'age', 'description': 'the age of the person', 'datatype': 'Integer'}, {'name': 'gender', 'description': 'the gender of the person', 'datatype': 'String'}]","[{'name': 'HealthInformation', 'description': 'the general health information', 'datatype': 'String'}]",,
GetDietPlan,GetDietPlan(HealthInformation) -> DietPlan,286,This API generates a diet plan based on the provided health information.,This API generates a diet plan based on the provided health information.,"[{'name': 'HealthInformation', 'description': 'the general health information', 'datatype': 'String'}]","[{'name': 'DietPlan', 'description': 'the generated diet plan', 'datatype': 'String'}]",,
GetExerciseRoutine,GetExerciseRoutine(HealthInformation) -> ExerciseRoutine,287,This API recommends an exercise routine based on the health information.,This API recommends an exercise routine based on the health information.,"[{'name': 'HealthInformation', 'description': 'the general health information', 'datatype': 'String'}]","[{'name': 'ExerciseRoutine', 'description': 'the recommended exercise routine', 'datatype': 'String'}]",,
CreateWellnessPlan,"CreateWellnessPlan(DietPlan, ExerciseRoutine) -> WellnessPlan",288,This API creates a comprehensive wellness plan that includes a diet plan and exercise routine.,This API creates a comprehensive wellness plan that includes a diet plan and exercise routine.,"[{'name': 'DietPlan', 'description': 'the generated diet plan', 'datatype': 'String'}, {'name': 'ExerciseRoutine', 'description': 'the recommended exercise routine', 'datatype': 'String'}]","[{'name': 'WellnessPlan', 'description': 'the comprehensive wellness plan', 'datatype': 'String'}]",,
FetchMovieDetails,FetchMovieDetails(title) -> MovieDetails,289,This API retrieves the details of a movie by its title.,This API retrieves the details of a movie by its title.,"[{'name': 'title', 'description': 'the title of the movie', 'datatype': 'String'}]","[{'name': 'MovieDetails', 'description': 'the details of the movie', 'datatype': 'Object'}]",,
GetDirectorFilmography,GetDirectorFilmography(Directorname) -> DirectorFilmography,290,This API retrieves the filmography of a director by their name.,This API retrieves the filmography of a director by their name.,"[{'name': 'Directorname', 'description': 'the name of the director', 'datatype': 'String'}]","[{'name': 'DirectorFilmography', 'description': 'the filmography of the director', 'datatype': 'Object'}]",,
SuggestSimilarMovies,SuggestSimilarMovies(MovieDetails) -> SimilarMovies,291,This API suggests similar movies based on the given movie details.,This API suggests similar movies based on the given movie details.,"[{'name': 'MovieDetails', 'description': 'the details of the movie', 'datatype': 'Object'}]","[{'name': 'SimilarMovies', 'description': 'the list of similar movies', 'datatype': 'Object'}]",,
BuildMoviePlaylist,"BuildMoviePlaylist(MovieDetails, SimilarMovies, DirectorFilmography) -> MoviePlaylist",292,"This API builds a movie playlist including the main movie, similar movies and other movies from the same director.","This API builds a movie playlist including the main movie, similar movies and other movies from the same director.","[{'name': 'MovieDetails', 'description': 'the details of the main movie', 'datatype': 'Object'}, {'name': 'SimilarMovies', 'description': 'the list of similar movies', 'datatype': 'Object'}, {'name': 'DirectorFilmography', 'description': 'the filmography of the director', 'datatype': 'Object'}]","[{'name': 'MoviePlaylist', 'description': 'the movie playlist', 'datatype': 'Object'}]",,
GetBookGenre,GetBookGenre(bookTitle) -> BookGenre,293,This API provides the genre of a specified book.,This API provides the genre of a specified book.,"[{'name': 'bookTitle', 'description': 'the title of the book', 'datatype': 'String'}]","[{'name': 'BookGenre', 'description': 'the genre of the book', 'datatype': 'String'}]",,
GetAuthorDetails,GetAuthorDetails(bookTitle) -> AuthorDetails,294,This API provides the details of the author of the specified book.,This API provides the details of the author of the specified book.,"[{'name': 'bookTitle', 'description': 'the title of the book', 'datatype': 'String'}]","[{'name': 'AuthorDetails', 'description': 'the details of the author', 'datatype': 'String'}]",,
GetSimilarBooks,"GetSimilarBooks(BookGenre, AuthorDetails) -> SimilarBooksList",295,This API provides a list of similar books based on the input of book genre and author details.,This API provides a list of similar books based on the input of book genre and author details.,"[{'name': 'BookGenre', 'description': 'the genre of the book', 'datatype': 'String'}, {'name': 'AuthorDetails', 'description': 'the details of the author', 'datatype': 'String'}]","[{'name': 'SimilarBooksList', 'description': 'a list of similar books', 'datatype': 'List'}]",,
CheckInventory,CheckInventory(productID) -> InventoryStatus,296,This API checks the inventory status of a specific product.,This API checks the inventory status of a specific product.,"[{'name': 'productID', 'description': 'the ID of the product', 'datatype': 'Integer'}]","[{'name': 'InventoryStatus', 'description': 'the inventory status of the product', 'datatype': 'String'}]",,
EstimateDeliveryTime,"EstimateDeliveryTime(productID, location) -> DeliveryTime",297,This API estimates the delivery time for a product to a specific location.,This API estimates the delivery time for a product to a specific location.,"[{'name': 'productID', 'description': 'the ID of the product', 'datatype': 'Integer'}, {'name': 'location', 'description': 'the location for delivery', 'datatype': 'String'}]","[{'name': 'DeliveryTime', 'description': 'the estimated delivery time for the product', 'datatype': 'String'}]",,
